{
  "package_id": "ep-cep-callback-001",
  "task_id": "task-001",
  "indexed_evidence": [
    {
      "ref": "memory:failure-pattern:cep-callback-non-function",
      "source_type": "index",
      "path": "reference/CSInterface.js",
      "hash": "example-sha256",
      "line_start": 520,
      "line_end": 530,
      "snippet": "Provided callback is not a function",
      "authority": 6,
      "verified": true,
      "classification": "verified_failure_pattern"
    }
  ],
  "workspace_evidence": [
    {
      "ref": "workspace:file:cep/client/app.js",
      "source_type": "workspace",
      "path": "cep/client/app.js",
      "hash": "current-workspace-sha256",
      "line_start": 110,
      "line_end": 124,
      "snippet": "csInterface.evalScript(payload, callbackValue);",
      "authority": 2,
      "verified": true,
      "classification": "production_source"
    }
  ],
  "validation_evidence": [],
  "contradictions": [],
  "gaps": [
    "Narrow callback reproduction has not run."
  ]
}
